{
  "measure_id": "OP_BE",
  "measure_name": "OP_BE",
  "display_name": "Operating Profitability",
  "factor": "Profitability",
  "description": "Operating Profit scaled by Book Equity. OP/BE = (Revenue - COGS - SG&A - Interest Expense) / Book Equity. Used in Fama-French five-factor model.",
  "formula": {
    "type": "ratio",
    "numerator": "operating_profit_ttm",
    "denominator": "book_value_equity",
    "window": "TTM"
  },
  "normalization": "zscore_cross_sectional",
  "original_paper_id": "paper_003",
  "aliases": ["OP/BE", "Operating Profitability to Book Equity"],
  "notes": "Fama-French (2015) 五因子模型中 RMW (Robust Minus Weak) 因子的定義。"
}
