{
  "measure_id": "SP_TTM",
  "measure_name": "SP_TTM",
  "display_name": "Sales to Price (TTM)",
  "factor": "Value",
  "description": "Sales to Price ratio using trailing twelve months revenue. SP = Revenue (TTM) / Market Cap.",
  "formula": {
    "type": "ratio",
    "numerator": "revenue_ttm",
    "denominator": "market_value_equity",
    "window": "TTM"
  },
  "normalization": "zscore_cross_sectional",
  "original_paper_id": null,
  "aliases": ["S/P", "Sales Yield", "Revenue to Price"],
  "notes": "營收基礎的價值指標，適用於虧損公司的估值比較。"
}
