{
  "measure_id": "VOL_36M",
  "measure_name": "VOL_36M",
  "display_name": "36-Month Volatility",
  "factor": "Low Volatility",
  "description": "Standard deviation of monthly returns over the past 36 months. Lower volatility stocks tend to have higher risk-adjusted returns, contradicting CAPM predictions.",
  "formula": {
    "type": "rolling",
    "metric": "standard_deviation",
    "base": "monthly_returns",
    "window": "36M"
  },
  "normalization": "rank",
  "original_paper_id": "paper_009",
  "aliases": ["Historical Volatility", "Total Volatility", "Realized Volatility"],
  "notes": "Blitz and van Vliet (2007) 發現總波動度至少與 beta 同樣有效。低波動效應自 1970 年代即有文獻記載，但長期被忽視。"
}
